paperID,title_pdftitle,title_pypdf2
/Users/sherry/Google_Drive/transfer/subset2_4/SchRecSubset4/SAC/SAC2010/p2319-sulayman.pdf,"Quantitative Assessments of Key Success Factors in Software Process Improvement for Small and Medium Web Companies
",Quantitative assessments of key success factors in software process improvement for small and medium web companies
/Users/sherry/Google_Drive/transfer/subset2_4/SchRecSubset4/SAC/SAC2010/p1131-barros.pdf,"Evolutionary Model Tree Induction
",Evolutionary model tree induction
/Users/sherry/Google_Drive/transfer/subset2_4/SchRecSubset4/SAC/SAC2010/p1438-mustapha.pdf,"Enhancing Semantic Search using Case-Based Modular Ontology
",Enhancing semantic search using case-based modular ontology
/Users/sherry/Google_Drive/transfer/subset2_4/SchRecSubset4/SAC/SAC2010/p1516-bicego.pdf,"Expression Microarray Classiﬁcation using Topic Models
",Expression microarray classification using topic models
/Users/sherry/Google_Drive/transfer/subset2_4/SchRecSubset4/SAC/SAC2010/p367-nallur.pdf,"Design of a Market-Based Mechanism for Quality Attribute Tradeoff of Services in the Cloud
",Design of a market-based mechanism for quality attribute tradeoff of services in the cloud
/Users/sherry/Google_Drive/transfer/subset2_4/SchRecSubset4/SAC/SAC2010/p1373-groppe.pdf,"External Sorting for Index Construction of Large Semantic Web Databases
",External sorting for index construction of large semantic web databases
/Users/sherry/Google_Drive/transfer/subset2_4/SchRecSubset4/SAC/SAC2010/p52-rios.pdf,"Evaluation of Different Feature Sets in an OCR Free Method for Word Spotting in Printed Documents
",Evaluation of different feature sets in an OCR free method for word spotting in printed documents
/Users/sherry/Google_Drive/transfer/subset2_4/SchRecSubset4/SAC/SAC2010/p793-matthys.pdf,"Towards Fine-Grained and Application-Centric Access Control for Wireless Sensor Networks
",Towards fine-grained and application-centric access control for wireless sensor networks
/Users/sherry/Google_Drive/transfer/subset2_4/SchRecSubset4/SAC/SAC2010/p158-meertens.pdf,"Goal and model driven design of an architecture for a care service platform
",Goal and model driven design of an architecture for a care service platform
/Users/sherry/Google_Drive/transfer/subset2_4/SchRecSubset4/SAC/SAC2010/p2216-coen-porisini.pdf,"Dealing with Anonymity in Wireless Sensor Networks
",Dealing with anonymity in wireless sensor networks
/Users/sherry/Google_Drive/transfer/subset2_4/SchRecSubset4/SAC/SAC2010/p1584-gloe.pdf,"The ‘Dresden Image Database’ for Benchmarking Digital Image Forensics
",The 'Dresden Image Database' for benchmarking digital image forensics
/Users/sherry/Google_Drive/transfer/subset2_4/SchRecSubset4/SAC/SAC2010/p605-delis.pdf,"A Data Perturbation Approach to Sensitive Classiﬁcation Rule Hiding
",A data perturbation approach to sensitive classification rule hiding
/Users/sherry/Google_Drive/transfer/subset2_4/SchRecSubset4/SAC/SAC2010/p1440-lopes.pdf,"The Semantics of Personalised Web Accessibility Assessment
",The semantics of personalised web accessibility assessment
/Users/sherry/Google_Drive/transfer/subset2_4/SchRecSubset4/SAC/SAC2010/p1881-claycomb.pdf,,A framework for risk analysis in virtual directory security
/Users/sherry/Google_Drive/transfer/subset2_4/SchRecSubset4/SAC/SAC2010/p173-okamura.pdf,"Load-based Covert Channels between Xen Virtual Machines
",Load-based covert channels between Xen virtual machines
/Users/sherry/Google_Drive/transfer/subset2_4/SchRecSubset4/SAC/SAC2010/p1020-sami.pdf,"Malware Detection Based on Mining API Calls
",Malware detection based on mining API calls
/Users/sherry/Google_Drive/transfer/subset2_4/SchRecSubset4/SAC/SAC2010/p131-addicks.pdf,"A Method for Application Evaluations in Context of Enterprise Architecture
",A method for application evaluations in context of enterprise architecture
/Users/sherry/Google_Drive/transfer/subset2_4/SchRecSubset4/SAC/SAC2010/p1970-lee.pdf,"Detecting Metamorphic Malwares using Code Graphs
",Detecting metamorphic malwares using code graphs
/Users/sherry/Google_Drive/transfer/subset2_4/SchRecSubset4/SAC/SAC2010/p1034-leung.pdf,,Mining uncertain data for frequent itemsets that satisfy aggregate constraints
/Users/sherry/Google_Drive/transfer/subset2_4/SchRecSubset4/SAC/SAC2010/p1741-furukawa.pdf,,Prediction of social bookmarking based on a behavior transition model
/Users/sherry/Google_Drive/transfer/subset2_4/SchRecSubset4/SAC/SAC2010/p1449-o_callaghan.pdf,"Evaluating Trust in Grid Certiﬁcates
",Evaluating trust in grid certificates
/Users/sherry/Google_Drive/transfer/subset2_4/SchRecSubset4/SAC/SAC2010/p1224-maciel.pdf,"Reality Cues-Based Interaction Using Whole-Body Awareness
",Reality cues-based interaction using whole-body awareness
/Users/sherry/Google_Drive/transfer/subset2_4/SchRecSubset4/SAC/SAC2010/p2531-sami.pdf,"Design-Level Metrics Estimation Based on Code Metrics
",Design-level metrics estimation based on code metrics
/Users/sherry/Google_Drive/transfer/subset2_4/SchRecSubset4/SAC/SAC2010/p238-yi.pdf,,"ART: adaptive, reliable, and fault-tolerant task management for computational grids"
/Users/sherry/Google_Drive/transfer/subset2_4/SchRecSubset4/SAC/SAC2010/p2289-junior.pdf,"An Overview and an Empirical Evaluation of UML-AOF – An UML Profile for Aspect-Oriented Frameworks
",An overview and an empirical evaluation of UML-AOF: an UML profile for aspect-oriented frameworks
/Users/sherry/Google_Drive/transfer/subset2_4/SchRecSubset4/SAC/SAC2010/p1323-harsh.pdf,"Gray Networking
",Gray networking: a step towards next generation computer networks
/Users/sherry/Google_Drive/transfer/subset2_4/SchRecSubset4/SAC/SAC2010/p2451-choppy.pdf,"A Well-Founded Approach to Service Modelling with Casl4Soa
",A well-founded approach to service modelling with Casl4Soa: part 1 (service in isolation)
/Users/sherry/Google_Drive/transfer/subset2_4/SchRecSubset4/SAC/SAC2010/p1472-saadi.pdf,"T2D: A Peer to Peer trust management system based on Disposition to Trust
",T2D: a peer to peer trust management system based on disposition to trust
/Users/sherry/Google_Drive/transfer/subset2_4/SchRecSubset4/SAC/SAC2010/p59-kavallieratou.pdf,"Text Line Detection and Segmentation: uneven Skew Angles and Hill-and-Dale writing
",Text line detection and segmentation: uneven skew angles and hill-and-dale writing
/Users/sherry/Google_Drive/transfer/subset2_4/SchRecSubset4/SAC/SAC2010/p1054-flouvat.pdf,"Constrained colocation mining : application to soil erosion characterization
",Constrained colocation mining: application to soil erosion characterization
/Users/sherry/Google_Drive/transfer/subset2_4/SchRecSubset4/SAC/SAC2010/p1213-hayashi.pdf,"Understanding Meta-communication in an Inclusive Scenario
",Understanding meta-communication in an inclusive scenario
/Users/sherry/Google_Drive/transfer/subset2_4/SchRecSubset4/SAC/SAC2010/p2252-park.pdf,"An Approach to Developing Reusable Domain Services for Service Oriented Applications
",An approach to developing reusable domain services for service oriented applications
/Users/sherry/Google_Drive/transfer/subset2_4/SchRecSubset4/SAC/SAC2010/p1821-saad-missen.pdf,"Using Passage-Based Language ModelForOpinion Detection in Blogs
",Using passage-based language model for opinion detection in blogs
/Users/sherry/Google_Drive/transfer/subset2_4/SchRecSubset4/SAC/SAC2010/p1491-roy.pdf,"Visual processing-inspired Fern-Audio features for Noise-Robust Speaker Veriﬁcation
",Visual processing-inspired fern-audio features for noise-robust speaker verification
/Users/sherry/Google_Drive/transfer/subset2_4/SchRecSubset4/SAC/SAC2010/p997-goethals.pdf,,Mining interesting sets and rules in relational databases
/Users/sherry/Google_Drive/transfer/subset2_4/SchRecSubset4/SAC/SAC2010/p1113-belohlavek.pdf,,Background knowledge in formal concept analysis: constraints via closure operators
/Users/sherry/Google_Drive/transfer/subset2_4/SchRecSubset4/SAC/SAC2010/p194-heo.pdf,"Energy Efﬁcient Program Updating for Sensor Nodes with Flash Memory
",Energy efficient program updating for sensor nodes with flash memory
/Users/sherry/Google_Drive/transfer/subset2_4/SchRecSubset4/SAC/SAC2010/p306-spinola.pdf,"UbiCheck
",<i>UbiCheck</i>: an approach to support requirements definition in the ubicomp domain
/Users/sherry/Google_Drive/transfer/subset2_4/SchRecSubset4/SAC/SAC2010/p1277-ho.pdf,"Simulated Annealing based Algorithm for Smooth Robot Path Planning with Different Kinematic Constraints
",Simulated annealing based algorithm for smooth robot path planning with different kinematic constraints
/Users/sherry/Google_Drive/transfer/subset2_4/SchRecSubset4/SAC/SAC2010/p1103-campan.pdf,"User-Controlled Generalization Boundaries for
",User-controlled generalization boundaries for <i>p</i>-sensitive <i>k</i>-anonymity
/Users/sherry/Google_Drive/transfer/subset2_4/SchRecSubset4/SAC/SAC2010/p1755-beigbeder.pdf,"Focused retrieval with proximity scoring
",Focused retrieval with proximity scoring
/Users/sherry/Google_Drive/transfer/subset2_4/SchRecSubset4/SAC/SAC2010/p731-jung.pdf,"ASTRAL
","<i>ASTRAL</i>: an adaptive, efficient, and reliable flooding mechanism for MANET"
/Users/sherry/Google_Drive/transfer/subset2_4/SchRecSubset4/SAC/SAC2010/p1781-kang.pdf,"A Knowledge-rich Similarity Measure for Improving IT Incident Resolution Process
",A knowledge-rich similarity measure for improving IT incident resolution process
/Users/sherry/Google_Drive/transfer/subset2_4/SchRecSubset4/SAC/SAC2010/p61-lins.pdf,"A DeWarping Algorithm to Compensate Volume Binding Distortion in Scanned Documents
",A dewarping algorithm to compensate volume binding distortion in scanned documents
/Users/sherry/Google_Drive/transfer/subset2_4/SchRecSubset4/SAC/SAC2010/p1002-fernandes.pdf,"The Impact of Random Samples in Ensemble Classiﬁers
",The impact of random samples in ensemble classifiers
/Users/sherry/Google_Drive/transfer/subset2_4/SchRecSubset4/SAC/SAC2010/p575-maia.pdf,"Considerations on developing mobile applications based on the Capuchin project
",Considerations on developing mobile applications based on the Capuchin project
/Users/sherry/Google_Drive/transfer/subset2_4/SchRecSubset4/SAC/SAC2010/p663-anelli.pdf,"Transport Congestion Events Detection (TCED): Towards Decorrelating Congestion Detection from TCP
",Transport congestion events detection (TCED): towards decorrelating congestion detection from TCP
/Users/sherry/Google_Drive/transfer/subset2_4/SchRecSubset4/SAC/SAC2010/p475-correia.pdf,"Asynchronous Byzantine Consensus with 2f+1 Processes
",Asynchronous Byzantine consensus with 2f+1 processes
/Users/sherry/Google_Drive/transfer/subset2_4/SchRecSubset4/SAC/SAC2010/p2406-kokash.pdf,"Data-Aware Design and Veriﬁcation of Service Compositions with Reo and mCRL2
",Data-aware design and verification of service compositions with Reo and mCRL2
/Users/sherry/Google_Drive/transfer/subset2_4/SchRecSubset4/SAC/SAC2010/p2472-hallwyl.pdf,"A standard-driven implementaion of WS-BPEL 2.0
",A standard-driven implementaion of WS-BPEL 2.0
/Users/sherry/Google_Drive/transfer/subset2_4/SchRecSubset4/SAC/SAC2010/p818-mao.pdf,"A Robust Link-Translating Proxy Server Mirroring the Whole Web
",A robust link-translating proxy server mirroring the whole web
/Users/sherry/Google_Drive/transfer/subset2_4/SchRecSubset4/SAC/SAC2010/p694-lenz.pdf,"SeRViSO: A Selective Retransmission Scheme for Video Streaming in Overlay Networks
",SeRViSO: a selective retransmission scheme for video streaming in overlay networks
/Users/sherry/Google_Drive/transfer/subset2_4/SchRecSubset4/SAC/SAC2010/p1919-paolino.pdf,"An Evaluation of the Sinuosity Effect on Visualization of RDP Simplified Maps - An Empirical Study
",An evaluation of the sinuosity effect on visualization of RDP simplified maps: an empirical study
/Users/sherry/Google_Drive/transfer/subset2_4/SchRecSubset4/SAC/SAC2010/p1305-fotoohi.pdf,"A Supervisory Control Approach for Safe Behavior of Service Robot Case Study: FRIEND
",A supervisory control approach for safe behavior of service robot case study: FRIEND
/Users/sherry/Google_Drive/transfer/subset2_4/SchRecSubset4/SAC/SAC2010/p936-goncalves.pdf,"Towards the Modeling Reactive and Proactive Agents by Using MAS-ML
",Towards the modeling reactive and proactive agents by using MAS-ML
/Users/sherry/Google_Drive/transfer/subset2_4/SchRecSubset4/SAC/SAC2010/p2211-krishnan.pdf,"Data Generation in Model-Based Testing
",Data generation in model-based testing
/Users/sherry/Google_Drive/transfer/subset2_4/SchRecSubset4/SAC/SAC2010/p1229-maciel.pdf,"Collaborative Interaction through Spatially Aware Moving Displays
",Collaborative interaction through spatially aware moving displays
/Users/sherry/Google_Drive/transfer/subset2_4/SchRecSubset4/SAC/SAC2010/p876-miletto.pdf,"Social Music Making on the Web with CODES
",Social music making on the web with CODES
/Users/sherry/Google_Drive/transfer/subset2_4/SchRecSubset4/SAC/SAC2010/p2257-hansen.pdf,"Modeling and Analyzing Architectural Change with Alloy
",Modeling and analyzing architectural change with alloy
/Users/sherry/Google_Drive/transfer/subset2_4/SchRecSubset4/SAC/SAC2010/p1153-araujo.pdf,"Hybrid Evolutionary Quantum Inspired Method to Adjust Time Phase Distortions in Financial Time Series
",Hybrid evolutionary quantum inspired method to adjust time phase distortions in financial time series
/Users/sherry/Google_Drive/transfer/subset2_4/SchRecSubset4/SAC/SAC2010/p137-hummel.pdf,"Towards Quality-Aware Development and Evolution of Enterprise Information Systems
",Towards quality-aware development and evolution of enterprise information systems
/Users/sherry/Google_Drive/transfer/subset2_4/SchRecSubset4/SAC/SAC2010/p2517-vogels.pdf,,A machine-checked soundness proof for an efficient verification condition generator
/Users/sherry/Google_Drive/transfer/subset2_4/SchRecSubset4/SAC/SAC2010/p1454-maranzato.pdf,"Fraud Detection in Reputation Systems in e-Markets using Logistic Regression
",Fraud detection in reputation systems in e-markets using logistic regression
/Users/sherry/Google_Drive/transfer/subset2_4/SchRecSubset4/SAC/SAC2010/p189-lee.pdf,"A hybrid prefetch policy for the retrieval of link-associated information on vehicular networks
",A hybrid prefetch policy for the retrieval of link-associated information on vehicular networks
/Users/sherry/Google_Drive/transfer/subset2_4/SchRecSubset4/SAC/SAC2010/p1065-appice.pdf,"Transductive Learning for Spatial Regression with Co-Training
",Transductive learning for spatial regression with co-training
/Users/sherry/Google_Drive/transfer/subset2_4/SchRecSubset4/SAC/SAC2010/p1258-athanasiadis.pdf,"Feature-based 3D Morphing based on Geometrically Constrained Sphere Mapping Optimization
",Feature-based 3D morphing based on geometrically constrained sphere mapping optimization
/Users/sherry/Google_Drive/transfer/subset2_4/SchRecSubset4/SAC/SAC2010/p1547-cheng.pdf,"P
",PROM-OOGLE: data mining and integration of on-line databases to discover gene promoters
/Users/sherry/Google_Drive/transfer/subset2_4/SchRecSubset4/SAC/SAC2010/p111-lee-klenz.pdf,"A Requirements Elicitation Framework and Tool for Sourcing Business-IT Aligned e-Services
",A requirements elicitation framework and tool for sourcing business-IT aligned e-services
/Users/sherry/Google_Drive/transfer/subset2_4/SchRecSubset4/SAC/SAC2010/p1460-dolev.pdf,"Computing Multi-Party Trust Privately
",Computing multi-party trust privately: in <i>O</i>(<i>n</i>) time units sending one (possibly large) message at a time
/Users/sherry/Google_Drive/transfer/subset2_4/SchRecSubset4/SAC/SAC2010/p1115-ninagawa.pdf,"Link Prediction using Probabilistic Group Models of Network Structure
",Link prediction using probabilistic group models of network structure
/Users/sherry/Google_Drive/transfer/subset2_4/SchRecSubset4/SAC/SAC2010/p1107-mengle.pdf,"Mining Temporal Relationships among Categories
",Mining temporal relationships among categories
/Users/sherry/Google_Drive/transfer/subset2_4/SchRecSubset4/SAC/SAC2010/p799-skopik.pdf,"Trustworthy Interaction Balancing in Mixed Service-oriented Systems
",Trustworthy interaction balancing in mixed service-oriented systems
/Users/sherry/Google_Drive/transfer/subset2_4/SchRecSubset4/SAC/SAC2010/p292-alencar.pdf,"Towards Modular i* Models
",Towards modular i* models
/Users/sherry/Google_Drive/transfer/subset2_4/SchRecSubset4/SAC/SAC2010/p906-chen.pdf,"Modeling Cardinal Directions in the 3D Space with the Objects Interaction Cube Matrix
",Modeling cardinal directions in the 3D space with the objects interaction cube matrix
/Users/sherry/Google_Drive/transfer/subset2_4/SchRecSubset4/SAC/SAC2010/p1444-hogenboom.pdf,,A review of approaches for representing RCC8 in OWL
/Users/sherry/Google_Drive/transfer/subset2_4/SchRecSubset4/SAC/SAC2010/p2311-wang.pdf,"Reﬁnement of Models of Software Components
",Refinement of models of software components
/Users/sherry/Google_Drive/transfer/subset2_4/SchRecSubset4/SAC/SAC2010/p206-rajgarhia.pdf,"Performance and Extension of User Space File Systems
",Performance and extension of user space file systems
/Users/sherry/Google_Drive/transfer/subset2_4/SchRecSubset4/SAC/SAC2010/p2119-gomes.pdf,"Design Pattern Implementation in Object Teams
",Design pattern implementation in object teams
/Users/sherry/Google_Drive/transfer/subset2_4/SchRecSubset4/SAC/SAC2010/p452-wang.pdf,"Improving Complex Distributed Software System Availability Through Information Hiding
",Improving complex distributed software system availability through information hiding
/Users/sherry/Google_Drive/transfer/subset2_4/SchRecSubset4/SAC/SAC2010/p1601-ahmed.pdf,"Fast File-type Identiﬁcation
",Fast file-type identification
/Users/sherry/Google_Drive/transfer/subset2_4/SchRecSubset4/SAC/SAC2010/p1723-durao.pdf,"Extending a Hybrid Tag-Based Recommender System with Personalization
",Extending a hybrid tag-based recommender system with personalization
/Users/sherry/Google_Drive/transfer/subset2_4/SchRecSubset4/SAC/SAC2010/p1442-shin.pdf,,ONTOMO: web-based ontology building system: ---instance recommendation using bootstrapping---
/Users/sherry/Google_Drive/transfer/subset2_4/SchRecSubset4/SAC/SAC2010/p2360-sobernig.pdf,"Feature Interaction Networks
",Feature interaction networks
/Users/sherry/Google_Drive/transfer/subset2_4/SchRecSubset4/SAC/SAC2010/p1105-zeng.pdf,"Introducing Global Scaling Parameters into Ncut
",Introducing global scaling parameters into Ncut
/Users/sherry/Google_Drive/transfer/subset2_4/SchRecSubset4/SAC/SAC2010/p1423-fanizzi.pdf,"Towards the Induction of Terminological Decision Trees
",Towards the induction of terminological decision trees
/Users/sherry/Google_Drive/transfer/subset2_4/SchRecSubset4/SAC/SAC2010/p1381-bagheri.pdf,"Evidential Reasoning for the Treatment of Incoherent Terminologies
",Evidential reasoning for the treatment of incoherent terminologies
/Users/sherry/Google_Drive/transfer/subset2_4/SchRecSubset4/SAC/SAC2010/p812-kuuskeri.pdf,"Peer-to-Peer Collaboration in the Lively Kernel
",Peer-to-peer collaboration in the lively kernel
/Users/sherry/Google_Drive/transfer/subset2_4/SchRecSubset4/SAC/SAC2010/p2144-llorens.pdf,"An Algorithm to Generate the Context-sensitive Synchronized Control Flow Graph
",An algorithm to generate the context-sensitive synchronized control flow graph
/Users/sherry/Google_Drive/transfer/subset2_4/SchRecSubset4/SAC/SAC2010/p2367-shahin.pdf,"Rationale Visualization of Software Architectural Design Decision using Compendium
",Rationale visualization of software architectural design decision using compendium
/Users/sherry/Google_Drive/transfer/subset2_4/SchRecSubset4/SAC/SAC2010/p57-lesner.pdf,,"A novel framework to detect source code plagiarism: now, students have to work for real!"
/Users/sherry/Google_Drive/transfer/subset2_4/SchRecSubset4/SAC/SAC2010/p2491-liu.pdf,"Can Domain-Specific Languages Be Implemented by Service-Oriented Architecture?
",Can domain-specific languages be implemented by service-oriented architecture?
/Users/sherry/Google_Drive/transfer/subset2_4/SchRecSubset4/SAC/SAC2010/p2176-ebraert.pdf,"Intensional changes
",Intensional changes: modularizing crosscutting features
/Users/sherry/Google_Drive/transfer/subset2_4/SchRecSubset4/SAC/SAC2010/p2224-chang.pdf,"SysML-based Requirement Modeling Environment for Multicore Embedded System
",SysML-based requirement modeling environment for multicore embedded system
/Users/sherry/Google_Drive/transfer/subset2_4/SchRecSubset4/SAC/SAC2010/p2281-voigt.pdf,"MatchBox: Combined Meta-model Matching for Semi-automatic Mapping Generation
",MatchBox: combined meta-model matching for semi-automatic mapping generation
/Users/sherry/Google_Drive/transfer/subset2_4/SchRecSubset4/SAC/SAC2010/p1774-lamprier.pdf,"Traveling among Clusters: a Way to Reconsider the Beneﬁts of the Cluster Hypothesis
",Traveling among clusters: a way to reconsider the benefits of the cluster hypothesis
/Users/sherry/Google_Drive/transfer/subset2_4/SchRecSubset4/SAC/SAC2010/p941-huang.pdf,"Semantic Scene Detection System for Baseball Videos Based on the MPEG-7 Specification
",Semantic scene detection system for baseball videos based on the MPEG-7 specification
/Users/sherry/Google_Drive/transfer/subset2_4/SchRecSubset4/SAC/SAC2010/p1428-esposito.pdf,,Recovering uncertain mappings through structural validation and aggregation with the MoTo system
/Users/sherry/Google_Drive/transfer/subset2_4/SchRecSubset4/SAC/SAC2010/p8-stoffel.pdf,"Enhancing Document Structure Analysis using Visual Analytics
",Enhancing document structure analysis using visual analytics
/Users/sherry/Google_Drive/transfer/subset2_4/SchRecSubset4/SAC/SAC2010/p86-dirgahayu.pdf,"Interaction Refinement in the Design of Business Collaborations
",Interaction refinement in the design of business collaborations
/Users/sherry/Google_Drive/transfer/subset2_4/SchRecSubset4/SAC/SAC2010/p1315-eyiyurekli.pdf,"Chemotaxis-based Sorting of Self-Organizing Heterotypic Agents
",Chemotaxis-based sorting of self-organizing heterotypic agents
/Users/sherry/Google_Drive/transfer/subset2_4/SchRecSubset4/SAC/SAC2010/p2131-dos_reis.pdf,,General constant expressions for system programming languages
/Users/sherry/Google_Drive/transfer/subset2_4/SchRecSubset4/SAC/SAC2010/p2459-baude.pdf,"ESB Federation for Large-Scale SOA
",ESB federation for large-scale SOA
/Users/sherry/Google_Drive/transfer/subset2_4/SchRecSubset4/SAC/SAC2010/p1511-webster.pdf,"A Framework for Cross-Disciplinary Hypothesis Generation
",A framework for cross-disciplinary hypothesis generation
/Users/sherry/Google_Drive/transfer/subset2_4/SchRecSubset4/SAC/SAC2010/p2073-karakashian.pdf,,Relational consistency by constraint filtering
/Users/sherry/Google_Drive/transfer/subset2_4/SchRecSubset4/SAC/SAC2010/p2369-thapa.pdf,"Assessing the Impact of Refactoring Activities on the JHotDraw Project
",Assessing the impact of refactoring activities on the JHotDraw project
/Users/sherry/Google_Drive/transfer/subset2_4/SchRecSubset4/SAC/SAC2010/p737-kim.pdf,"Integrating Real-Time Hybrid Task Scheduling into a Senor Node Platform
",Integrating real-time hybrid task scheduling into a sensor node platform
/Users/sherry/Google_Drive/transfer/subset2_4/SchRecSubset4/SAC/SAC2010/p1010-qin.pdf,"A Bayesian Classiﬁer for Uncertain Data
",A Bayesian classifier for uncertain data
/Users/sherry/Google_Drive/transfer/subset2_4/SchRecSubset4/SAC/SAC2010/p2493-chabeb.pdf,"Publication and Discovery of YASA Web Services
",Publication and discovery of YASA web services
/Users/sherry/Google_Drive/transfer/subset2_4/SchRecSubset4/SAC/SAC2010/p2049-goldsztejn.pdf,"Box Consistency through Adaptive Shaving
",Box consistency through adaptive shaving
/Users/sherry/Google_Drive/transfer/subset2_4/SchRecSubset4/SAC/SAC2010/p2402-ji.pdf,,A simulation of large-scale groundwater flow on CUDA-enabled GPUs
/Users/sherry/Google_Drive/transfer/subset2_4/SchRecSubset4/SAC/SAC2010/p359-facchinetti.pdf,"Resource partitioning for real-time processing on a multicore architecture
",Resource partitioning for real-time processing on a multicore architecture
/Users/sherry/Google_Drive/transfer/subset2_4/SchRecSubset4/SAC/SAC2010/p831-de_la_ossa.pdf,"Referrer Graph: a low-cost web prediction algorithm
",Referrer graph: a low-cost web prediction algorithm
/Users/sherry/Google_Drive/transfer/subset2_4/SchRecSubset4/SAC/SAC2010/p496-chamberlain.pdf,,Application-guided tool development for architecturally diverse computation
/Users/sherry/Google_Drive/transfer/subset2_4/SchRecSubset4/SAC/SAC2010/p839-bozzson.pdf,"Integration of a Human Face Annotation Technology in an Audio-visual Search Engine Platform
",Integration of a human face annotation technology in an audio-visual search engine platform
/Users/sherry/Google_Drive/transfer/subset2_4/SchRecSubset4/SAC/SAC2010/p2037-nardini.pdf,"Coordination in Open and Dynamic Environments with TuCSoN Semantic Tuple Centres
",Coordination in open and dynamic environments with TuCSoN semantic tuple centres
/Users/sherry/Google_Drive/transfer/subset2_4/SchRecSubset4/SAC/SAC2010/p1138-ghoulbeigi.pdf,,Probabilistic developmental program evolution
/Users/sherry/Google_Drive/transfer/subset2_4/SchRecSubset4/SAC/SAC2010/p1854-almeida.pdf,"Filtering Spams using the Minimum Description Length Principle
",Filtering spams using the minimum description length principle
/Users/sherry/Google_Drive/transfer/subset2_4/SchRecSubset4/SAC/SAC2010/p2344-kamal.pdf,"Modeling the Variability of Architectural Patterns
",Modeling the variability of architectural patterns
/Users/sherry/Google_Drive/transfer/subset2_4/SchRecSubset4/SAC/SAC2010/p33-lins.pdf,"Automatically Detecting and Classifying Noises in Document Images
",Automatically detecting and classifying noises in document images
