paperID,title_pdftitle,title_pypdf2
/Users/sherry/Google_Drive/transfer/subset2_4/SchRecSubset4/SAC/SAC2005/p863-menon.pdf,"A Code Compression Advisory Tool for Embedded Processors
",A Code Compression Advisory Tool for Embedded Processors
/Users/sherry/Google_Drive/transfer/subset2_4/SchRecSubset4/SAC/SAC2005/p38-pandey.pdf,,Stochastic Scheduling of Active Support Vector Learning Algorithms
/Users/sherry/Google_Drive/transfer/subset2_4/SchRecSubset4/SAC/SAC2005/p1328-schaad.pdf,"A case study of separation of duty properties in the context of the Austrian “eLaw” process.
",A Case Study of Separation of Duty Properties in the Context of the Austrian “eLaw” Process
/Users/sherry/Google_Drive/transfer/subset2_4/SchRecSubset4/SAC/SAC2005/p1096-tebri.pdf,,Incremental Profile Learning based on a Reinforcement Method
/Users/sherry/Google_Drive/transfer/subset2_4/SchRecSubset4/SAC/SAC2005/p843-yim.pdf,"A Fast Start-Up Technique for Flash Memory Based Computing Systems
",A Fast Start-Up Technique for Flash Memory Based Computing Systems
/Users/sherry/Google_Drive/transfer/subset2_4/SchRecSubset4/SAC/SAC2005/p993-bellaachia.pdf,"Efficiency of Prefix and Non-Prefix codes in String Matching over Compressed Databases on Handheld Devices
",Efficiency of Prefix and Non-Prefix codes in String Matching over Compressed Databases on Handheld Devices
/Users/sherry/Google_Drive/transfer/subset2_4/SchRecSubset4/SAC/SAC2005/p79-lau.pdf,"A Multi-Agent Approach for Solving Optimization Problems involving Expensive Resources
",A Multi-Agent Approach for Solving Optimization Problems involving Expensive Resources
/Users/sherry/Google_Drive/transfer/subset2_4/SchRecSubset4/SAC/SAC2005/p467-menezes.pdf,"Self-Organization and Computer Security
",Self-Organization and Computer Security
/Users/sherry/Google_Drive/transfer/subset2_4/SchRecSubset4/SAC/SAC2005/p141-jayadevaprakash.pdf,,Generating Association Graphs of Non-Co-occurring Text Objects using Transitive Methods
/Users/sherry/Google_Drive/transfer/subset2_4/SchRecSubset4/SAC/SAC2005/p27-zhou.pdf,"Data Driven Approach to Designing Minimum Hamming Distance Polychotomizer
",Data Driven Approach to Designing Minimum Hamming Distance Polychotomizer
/Users/sherry/Google_Drive/transfer/subset2_4/SchRecSubset4/SAC/SAC2005/p1599-roussos.pdf,"Editorial Message: Special Track on Ubiquitous Computing
",Track Editorial
/Users/sherry/Google_Drive/transfer/subset2_4/SchRecSubset4/SAC/SAC2005/p1365-wu.pdf,"A Two-Dimensional Separation of Concerns for Compiler Construction
",Microsoft Word - sac2005wu.doc
/Users/sherry/Google_Drive/transfer/subset2_4/SchRecSubset4/SAC/SAC2005/p1274-heinlein.pdf,"Vir tualNamespace Functions:An Alternative to Virtual Member Functions in C++and Advice in AspectC++
",Virtual Namespace Functions: An Alternative to Virtual Member Functions in C++ and Advice in AspectC++
/Users/sherry/Google_Drive/transfer/subset2_4/SchRecSubset4/SAC/SAC2005/p1668-kirsch-pinheiro.pdf,"Context-Aware Filtering for Collaborative Web Systems: Adapting the Awareness Information to the User’s Context
",Context-Aware Filtering for Collaborative Web Systems: Adapting the Awareness Information to the User’s Context
/Users/sherry/Google_Drive/transfer/subset2_4/SchRecSubset4/SAC/SAC2005/p1044-dong.pdf,"Text Classification Based on Data Partitioning and Parameter Varying Ensembles
",Text Classification Based on Data Partitioning and Parameter Varying Ensembles
/Users/sherry/Google_Drive/transfer/subset2_4/SchRecSubset4/SAC/SAC2005/p782-tarau.pdf,"Semantic Document Engineering with WordNet and PageRank
",Semantic Document Engineering with WordNet and PageRank
/Users/sherry/Google_Drive/transfer/subset2_4/SchRecSubset4/SAC/SAC2005/p1213-kim.pdf,"Similarity Measurement for Aggregation of Spatial Objects
",Similarity Measurement for Aggregation of Spatial Objects
/Users/sherry/Google_Drive/transfer/subset2_4/SchRecSubset4/SAC/SAC2005/p1357-de_carvalho.pdf,"The # Model: Separation of Concerns for Reconciling Modularity, Abstraction and Efﬁciency in Distributed Parallel Programming
","The # Model: Separation of Concerns for Reconciling Modularity, Abstraction and Efficiency in Distributed Parallel Programming"
/Users/sherry/Google_Drive/transfer/subset2_4/SchRecSubset4/SAC/SAC2005/p831-bravetti.pdf,,C:/Documents and Settings/guidicl/Desktop/sac temp/SacEct05.dvi
/Users/sherry/Google_Drive/transfer/subset2_4/SchRecSubset4/SAC/SAC2005/p488-song.pdf,"Finding Frequent Itemsets by Transaction Mapping
",Finding Frequent Itemsets by Transaction Mapping
/Users/sherry/Google_Drive/transfer/subset2_4/SchRecSubset4/SAC/SAC2005/p409-li.pdf,"The Shortest Route Cut and Fill Problem in Linear Topological Structure
",The Shortest Route Cut and Fill Problem in Linear Topological Structure
/Users/sherry/Google_Drive/transfer/subset2_4/SchRecSubset4/SAC/SAC2005/p1434-goualard.pdf,"On Considering an Interval Constraint Solving Algorithm as a Free-Steering Nonlinear Gauss-Seidel Procedure
",rca-sac-2005.dvi
/Users/sherry/Google_Drive/transfer/subset2_4/SchRecSubset4/SAC/SAC2005/p1151-da_costa.pdf,"A Reflective Middleware Architecture to Support AdaptiveMobile Applications
",A Reflective Middleware Architecture to Support Adaptive Mobile Applications
/Users/sherry/Google_Drive/transfer/subset2_4/SchRecSubset4/SAC/SAC2005/p1485-wong.pdf,"Source Code-Based Software Risk Assessing
",Source Code-Based Software Risk Assessing
/Users/sherry/Google_Drive/transfer/subset2_4/SchRecSubset4/SAC/SAC2005/p469-kim.pdf,"
",Performance Bottleneck in Time-Series Subsequence Matching
/Users/sherry/Google_Drive/transfer/subset2_4/SchRecSubset4/SAC/SAC2005/p695-rahman.pdf,"Replica Selection in Grid Environment: A Data-mining Approach
",Replica Selection in Grid Environment: A Data-mining Approach
/Users/sherry/Google_Drive/transfer/subset2_4/SchRecSubset4/SAC/SAC2005/p1613-fujinami.pdf,"Towards System Software for Physical Space Applications
",Towards System Software for Physical Space Applications
/Users/sherry/Google_Drive/transfer/subset2_4/SchRecSubset4/SAC/SAC2005/p759-lopresti.pdf,,Performance Evaluation for Text Processing of Noisy Inputs
/Users/sherry/Google_Drive/transfer/subset2_4/SchRecSubset4/SAC/SAC2005/p1570-kinateder.pdf,"Strong Pseudonymous Communication for Peer-to-Peer Reputation Systems
",Strong Pseudonymous Communication for Peer-to-Peer Reputation Systems
/Users/sherry/Google_Drive/transfer/subset2_4/SchRecSubset4/SAC/SAC2005/p411-ossowski.pdf,"Editorial Message
",Track Editorial
/Users/sherry/Google_Drive/transfer/subset2_4/SchRecSubset4/SAC/SAC2005/p1254-brown.pdf,"Issues in Augmenting Image Databases to Improve Processing Content-Based Similarity Searches
",Issues in Augmenting Image Databases to Improve Processing Content-Based Similarity Searches
/Users/sherry/Google_Drive/transfer/subset2_4/SchRecSubset4/SAC/SAC2005/p314-myles.pdf,"k-gram Based Software Birthmarks
",k-gram Based Software Birthmarks
/Users/sherry/Google_Drive/transfer/subset2_4/SchRecSubset4/SAC/SAC2005/p9-montes.pdf,"An hybridization of an ant-based clustering algorithm with growing neural gas networks for classiﬁcation tasks
",An Hybridization of an Ant-based Clustering Algorithm with Growing Neural Gas Networks for Classification Tasks
/Users/sherry/Google_Drive/transfer/subset2_4/SchRecSubset4/SAC/SAC2005/p1567-yang.pdf,"Mediation Framework Modeling and Veriﬁcation by SAM
",Mediation Framework Modeling and Verification by SAM
/Users/sherry/Google_Drive/transfer/subset2_4/SchRecSubset4/SAC/SAC2005/p398-lambert.pdf,"Solving Strategies using a Hybridization Model for Local Search and Constraint Propagation
",Solving Strategies using a Hybridization Model for Local Search and Constraint Propagation
/Users/sherry/Google_Drive/transfer/subset2_4/SchRecSubset4/SAC/SAC2005/p1626-omitola.pdf,,Declarative Control of the Future Home Environment
/Users/sherry/Google_Drive/transfer/subset2_4/SchRecSubset4/SAC/SAC2005/p206-wan.pdf,,Cleaning Microarray Expression Data using Markov Random Fields Based on Profile Similarity
/Users/sherry/Google_Drive/transfer/subset2_4/SchRecSubset4/SAC/SAC2005/p629-wojnicki.pdf,"Jelly View – A Technology for Arbitrarily Advanced Queries within RDBMS
",Jelly View – A Technology for Arbitrarily Advanced Queries within RDBMS
/Users/sherry/Google_Drive/transfer/subset2_4/SchRecSubset4/SAC/SAC2005/p1621-vishwanath.pdf,"Intelligent File Management in Ubiquitous Environments
",Intelligent File Management in Ubiquitous Environments
/Users/sherry/Google_Drive/transfer/subset2_4/SchRecSubset4/SAC/SAC2005/p573-gama.pdf,,Learning Decision Trees from Dynamic Data Streams
/Users/sherry/Google_Drive/transfer/subset2_4/SchRecSubset4/SAC/SAC2005/p752-lins.pdf,"Editorial Message: Special Track on Document Engineering
",Track Editorial
/Users/sherry/Google_Drive/transfer/subset2_4/SchRecSubset4/SAC/SAC2005/p718-quaglia.pdf,"Reliability in Three-Tier Systems without Application Server Coordination and Persistent Message Queues
",Reliability in Three-Tier Systems without Application Server Coordination and Persistent Message Queues
/Users/sherry/Google_Drive/transfer/subset2_4/SchRecSubset4/SAC/SAC2005/p1174-hara.pdf,"Location Management of Data Items in Mobile Ad Hoc Networks
",Location Management of Data Items in Mobile Ad Hoc Networks
/Users/sherry/Google_Drive/transfer/subset2_4/SchRecSubset4/SAC/SAC2005/p1534-trentini.pdf,"Plan validation via Petri Nets in the Real-Time Performers Java framework
",Plan Validation via Petri Nets in the Real-Time Performers Java Framework
/Users/sherry/Google_Drive/transfer/subset2_4/SchRecSubset4/SAC/SAC2005/p332-sohr.pdf,"Formal Speciﬁcation of Role-based Security Policies for Clinical Information Systems
",Healthcare_final.dvi
/Users/sherry/Google_Drive/transfer/subset2_4/SchRecSubset4/SAC/SAC2005/p1300-bleistein.pdf,"Strategic Alignment in Requirements Analysis for Organizational IT: an Integrated Approach
",Strategic Alignment in Requirements Analysis for Organizational IT: An Integrated Approach
/Users/sherry/Google_Drive/transfer/subset2_4/SchRecSubset4/SAC/SAC2005/p202-hsieh.pdf,"EXONSCAN: EXON Prediction with Signal Detection and Coding Region AligNment in Homologous Sequences
",EXONSCAN: EXON Prediction with Signal Detection and Coding Region AligNment in Homologous Sequences
/Users/sherry/Google_Drive/transfer/subset2_4/SchRecSubset4/SAC/SAC2005/p14-katayama.pdf,,Reinforcement Learning Agents with Primary Knowledge Designed by Analytic Hierarchy Process
/Users/sherry/Google_Drive/transfer/subset2_4/SchRecSubset4/SAC/SAC2005/p1112-shang.pdf,"Depth-First Frequent Itemset Mining in Relational Databases
",Depth-First Frequent Itemset Mining in Relational Databases
/Users/sherry/Google_Drive/transfer/subset2_4/SchRecSubset4/SAC/SAC2005/p634-liu.pdf,"Cost-Efﬁcient Processing of Min/Max Queries over Distributed Sensors with Uncertainty
",main.dvi
/Users/sherry/Google_Drive/transfer/subset2_4/SchRecSubset4/SAC/SAC2005/p1577-moloney.pdf,"Simulation of a distributed recommendation system for pervasive networks
",Simulation of a Distributed Recommendation System for Pervasive Networks
/Users/sherry/Google_Drive/transfer/subset2_4/SchRecSubset4/SAC/SAC2005/p1133-kaneda.pdf,"Transactional Agent Model for Fault-Tolerant Object Systems
",Transactional Agent Model for Fault-Tolerant Object Systems
/Users/sherry/Google_Drive/transfer/subset2_4/SchRecSubset4/SAC/SAC2005/p563-gao.pdf,"Quality-Driven Evaluation of Trigger Conditions on Streaming Time Series
",sacstream.dvi
/Users/sherry/Google_Drive/transfer/subset2_4/SchRecSubset4/SAC/SAC2005/p45-jang.pdf,,A Comparison on Information Fusion Methods for Air Target Identification
/Users/sherry/Google_Drive/transfer/subset2_4/SchRecSubset4/SAC/SAC2005/p287-rekhis.pdf,,A Formal Logic-based Language and an Automated Verification Tool for Computer Forensic Investigation
/Users/sherry/Google_Drive/transfer/subset2_4/SchRecSubset4/SAC/SAC2005/p1346-cazzola.pdf,"AOP for Software Evolution: A Design Oriented Approach
",AOP for Software Evolution: A Design Oriented Approach
/Users/sherry/Google_Drive/transfer/subset2_4/SchRecSubset4/SAC/SAC2005/p1727-adaikkalavan.pdf,"SmartGate: A Smart Push-Pull Approach to Support Role-Based Security in Web Gateways
",//tokyo.uta.edu/document/conf.papers/sac2005/SGate/CRC/SGate.dvi
/Users/sherry/Google_Drive/transfer/subset2_4/SchRecSubset4/SAC/SAC2005/p1470-blake.pdf,"Use Case-Driven Component Specification: A Medical Applications Perspective to Product Line Development
",Use Case-Driven Component Specification: A Medical Applications Perspective to Product Line Development
/Users/sherry/Google_Drive/transfer/subset2_4/SchRecSubset4/SAC/SAC2005/p1529-zhao.pdf,"Applying Agent Technology to Software Process Modeling and Process-Centered Software Engineering Environment
",Applying Agent Technology to Software Process Modeling and Process-Centered Software Engineering Environment
/Users/sherry/Google_Drive/transfer/subset2_4/SchRecSubset4/SAC/SAC2005/p292-hachey.pdf,,Sequence Modelling for Sentence Classification in a Legal Summarisation System
/Users/sherry/Google_Drive/transfer/subset2_4/SchRecSubset4/SAC/SAC2005/p617-bueno.pdf,"Accelerating Approximate Similarity Queries using Genetic Algorithms
",Accelerating Approximate Similarity Queries using Genetic Algorithms
/Users/sherry/Google_Drive/transfer/subset2_4/SchRecSubset4/SAC/SAC2005/p580-haraty.pdf,"Editorial Message: Special Track on Database Theory, Technology, and Applications
",Track Editorial
/Users/sherry/Google_Drive/transfer/subset2_4/SchRecSubset4/SAC/SAC2005/p151-bocker.pdf,"Efﬁcient Mass Decomposition
",mass_decomp.dvi
/Users/sherry/Google_Drive/transfer/subset2_4/SchRecSubset4/SAC/SAC2005/p975-watters.pdf,"Comparing Table Views for Small Devices
",Comparing Table Views for Small Devices
/Users/sherry/Google_Drive/transfer/subset2_4/SchRecSubset4/SAC/SAC2005/p302-ren.pdf,"Honeynet Based Distributed Adaptive Network Forensics and Active Real Time Investigation
",Honeynet based Distributed Adaptive Network Forensics and Active Real Time Investigation
/Users/sherry/Google_Drive/transfer/subset2_4/SchRecSubset4/SAC/SAC2005/p242-wu.pdf,"The Intensity Level Reduction in Radiation Therapy
",The Intensity Level Reduction in Radiation Therapy
/Users/sherry/Google_Drive/transfer/subset2_4/SchRecSubset4/SAC/SAC2005/p165-signorini.pdf,"Object-Oriented Wound Healing in the Liver: a Class-Structured View of Fibrogenesis and a Glimpse of its Evolution
",Object-Oriented Wound Healing in the Liver: a Class-Structured View of Fibrogenesis and a Glimpse of its Evolution
/Users/sherry/Google_Drive/transfer/subset2_4/SchRecSubset4/SAC/SAC2005/p808-zhang.pdf,,Effort and Accuracy Analysis of Choice Strategies for Electronic Product Catalogs
/Users/sherry/Google_Drive/transfer/subset2_4/SchRecSubset4/SAC/SAC2005/p493-janeja.pdf,"LS
",LS3: A Linear Semantic Scan Statistic Technique for Detecting Anomalous Windows
/Users/sherry/Google_Drive/transfer/subset2_4/SchRecSubset4/SAC/SAC2005/p498-ebert.pdf,,database.dvi
/Users/sherry/Google_Drive/transfer/subset2_4/SchRecSubset4/SAC/SAC2005/p961-mahmoud.pdf,"Special Track on Handheld Computing
",Track Editorial
/Users/sherry/Google_Drive/transfer/subset2_4/SchRecSubset4/SAC/SAC2005/p280-sartor.pdf,"Computer-aided Law and Advanced Technologies First International Legal Track, CLAT 2005 Santa Fè, New mexico, March 16, 2005 Revised and Invited Papers Preface
",Track Editorial
/Users/sherry/Google_Drive/transfer/subset2_4/SchRecSubset4/SAC/SAC2005/p340-ungureanu.pdf,,submit.dvi
/Users/sherry/Google_Drive/transfer/subset2_4/SchRecSubset4/SAC/SAC2005/p1054-li.pdf,"Using Recursive Classiﬁcation to Discover Predictive Features
",Using Recursive Classification to Discover Predictive Features
/Users/sherry/Google_Drive/transfer/subset2_4/SchRecSubset4/SAC/SAC2005/p1023-yee.pdf,,desc.dvi
/Users/sherry/Google_Drive/transfer/subset2_4/SchRecSubset4/SAC/SAC2005/p598-furfaro.pdf,"Hierarchical Binary Histograms for Summarizing Multi-Dimensional Data
",Hierarchical Binary Histograms for Summarizing Multi-Dimensional Data
/Users/sherry/Google_Drive/transfer/subset2_4/SchRecSubset4/SAC/SAC2005/p947-goettl.pdf,,Call Me E-Mail: Arranging the Keyboard with a Permutation-Coded Genetic Algorithm
/Users/sherry/Google_Drive/transfer/subset2_4/SchRecSubset4/SAC/SAC2005/p123-rahal.pdf,"Incremental Interactive Mining of Constrained Association Rules from Biological Annotation Data with Nominal Features
",Untitled Document
/Users/sherry/Google_Drive/transfer/subset2_4/SchRecSubset4/SAC/SAC2005/p1639-bonino.pdf,"Automatic learning of text-to-concept mappings exploiting WordNet-like lexical networks
",Automatic Learning of Text-to-concept Mappings Exploiting WordNet-like Lexical Networks
/Users/sherry/Google_Drive/transfer/subset2_4/SchRecSubset4/SAC/SAC2005/p928-de_falco.pdf,,sac05new.dvi
/Users/sherry/Google_Drive/transfer/subset2_4/SchRecSubset4/SAC/SAC2005/p623-behrend.pdf,"Optimizing Existential Queries in Stratiﬁable Deductive Databases
",Optimizing Existential Queries in Stratifiable Deductive Databases
/Users/sherry/Google_Drive/transfer/subset2_4/SchRecSubset4/SAC/SAC2005/p255-antonelli.pdf,"Segmentation and reconstruction of the lung volume in CT images
",Segmentation and Reconstruction of the Lung Volume in CT Images
/Users/sherry/Google_Drive/transfer/subset2_4/SchRecSubset4/SAC/SAC2005/p1256-ancona.pdf,,Track Editorial
/Users/sherry/Google_Drive/transfer/subset2_4/SchRecSubset4/SAC/SAC2005/p195-plake.pdf,,Optimizing Syntax Patterns for Discovering Protein-Protein Interactions
/Users/sherry/Google_Drive/transfer/subset2_4/SchRecSubset4/SAC/SAC2005/p610-stefanescu.pdf,"Distributed Evaluation of Generalized Path Queries
",Distributed Evaluation of Generalized Path Queries
/Users/sherry/Google_Drive/transfer/subset2_4/SchRecSubset4/SAC/SAC2005/p84-he.pdf,"Forming Resource-Sharing Coalitions: A Distributed Resource Allocation Mechanism for Self-Interested Agents in Computational Grids
",Forming Resource-Sharing Coalitions: A Distributed Resource Allocation Mechanism for Self-Interested Agents in Computational Grids
/Users/sherry/Google_Drive/transfer/subset2_4/SchRecSubset4/SAC/SAC2005/p208-balsara.pdf,"Prediction of Inherited and Genetic Mutations Using the Software Model Checker SPIN
",Prediction of Inherited and Genetic Mutations Using the Software Model Checker SPIN
/Users/sherry/Google_Drive/transfer/subset2_4/SchRecSubset4/SAC/SAC2005/p428-deniola.pdf,,DeNicola_et_al.dvi
/Users/sherry/Google_Drive/transfer/subset2_4/SchRecSubset4/SAC/SAC2005/p1120-gao.pdf,"Location Dependent Query Proxy*
",Location Dependent Query Proxy
/Users/sherry/Google_Drive/transfer/subset2_4/SchRecSubset4/SAC/SAC2005/p587-pauly.pdf,"Identifying Topological Predicates for Vague Spatial Objects
",Identifying Topological Predicates for Vague Spatial Objects
/Users/sherry/Google_Drive/transfer/subset2_4/SchRecSubset4/SAC/SAC2005/p1454-gruner.pdf,,Track Editorial
/Users/sherry/Google_Drive/transfer/subset2_4/SchRecSubset4/SAC/SAC2005/p729-monenizadeh.pdf,"The Necklace-Hypercube: A Well Scalable Hypercube-Based Interconnection Network for Multiprocessors
",The Necklace-Hypercube: A Well Scalable Hypercube-Based Interconnection Network for Multiprocessors
/Users/sherry/Google_Drive/transfer/subset2_4/SchRecSubset4/SAC/SAC2005/p1511-varma.pdf,"NextGen eXtreme Porting – Structured by Automation
",NextGen eXtreme Porting – Structured by Automation
/Users/sherry/Google_Drive/transfer/subset2_4/SchRecSubset4/SAC/SAC2005/p371-law.pdf,"Breaking Value Symmetries in Matrix Models using Channeling Constraints
",Breaking Value Symmetries in Matrix Models using Channeling Constraints
/Users/sherry/Google_Drive/transfer/subset2_4/SchRecSubset4/SAC/SAC2005/p789-braynov.pdf,,Track Editorial
/Users/sherry/Google_Drive/transfer/subset2_4/SchRecSubset4/SAC/SAC2005/p1499-rummel.pdf,,Towards the Prioritization of Regression Test Suites with Data Flow Information
/Users/sherry/Google_Drive/transfer/subset2_4/SchRecSubset4/SAC/SAC2005/p1385-emir.pdf,,Compiling Regular Patterns to Sequential Machines
/Users/sherry/Google_Drive/transfer/subset2_4/SchRecSubset4/SAC/SAC2005/p913-lim.pdf,"The Container Loading Problem
",C:\Documents and Settings\Administrator\Desktop\SAC Final\Container.DVI
/Users/sherry/Google_Drive/transfer/subset2_4/SchRecSubset4/SAC/SAC2005/p1679-zhou.pdf,"Measuring structural complexity for Class Diagrams: An Information Theory Approach
",Measuring Structure Complexity for Class Diagrams: An Information Theory Approach
/Users/sherry/Google_Drive/transfer/subset2_4/SchRecSubset4/SAC/SAC2005/p1333-schelp.pdf,"Extending the Business Engineering Framework for Application Integration Purposes
",Extending the Business Engineering Framework for Application Integration Purposes…
/Users/sherry/Google_Drive/transfer/subset2_4/SchRecSubset4/SAC/SAC2005/p1258-bettini.pdf,"Safe and Flexible Objects
",Safe and Flexible Objects
/Users/sherry/Google_Drive/transfer/subset2_4/SchRecSubset4/SAC/SAC2005/p260-huang.pdf,,A Clustering-based Approach for Prediction of Cardiac Resynchronization Therapy
/Users/sherry/Google_Drive/transfer/subset2_4/SchRecSubset4/SAC/SAC2005/p1478-canfora.pdf,"Confirming the influence of educational background in pair-design knowledge through experiments
",Confirming the Influence of Educational Background in Pair-design Knowledge through Experiments
/Users/sherry/Google_Drive/transfer/subset2_4/SchRecSubset4/SAC/SAC2005/p146-huang.pdf,"An approximation algorithm for haplotype inference by maximum parsimony
",An Approximation Algorithm for Haplotype Inference by Maximum Parsimony
/Users/sherry/Google_Drive/transfer/subset2_4/SchRecSubset4/SAC/SAC2005/p1563-dagostini.pdf,,Bridging AOP to SMP: Turning GCC into a Metalanguage Preprocessor
/Users/sherry/Google_Drive/transfer/subset2_4/SchRecSubset4/SAC/SAC2005/p99-palakal.pdf,"Editorial Message: Special Track on Bioinformatics
",Track Editorial
/Users/sherry/Google_Drive/transfer/subset2_4/SchRecSubset4/SAC/SAC2005/p543-morimoto.pdf,,Optimized Transitive Association Rule: Mining Significant Stopover between Events
/Users/sherry/Google_Drive/transfer/subset2_4/SchRecSubset4/SAC/SAC2005/p676-giannella.pdf,,An Information Theoretic Histogram for Single Dimensional Selectivity Estimation
/Users/sherry/Google_Drive/transfer/subset2_4/SchRecSubset4/SAC/SAC2005/p836-bechini.pdf,"Editorial Message for the Special Track on Embedded Systems: Applications, Solutions, and Techniques
",Track Editorial
/Users/sherry/Google_Drive/transfer/subset2_4/SchRecSubset4/SAC/SAC2005/p224-power.pdf,,deducibility.dvi
/Users/sherry/Google_Drive/transfer/subset2_4/SchRecSubset4/SAC/SAC2005/p1250-walker.pdf,"Surface Reconstruction Using Shadow Profilometry
",Surface Reconstruction Using Shadow Profilometry
/Users/sherry/Google_Drive/transfer/subset2_4/SchRecSubset4/SAC/SAC2005/p2-moore.pdf,,Keynote Address: Order Relations and Rigor in Computing
/Users/sherry/Google_Drive/transfer/subset2_4/SchRecSubset4/SAC/SAC2005/p1661-bocchi.pdf,"An OWL-S Based Approach to Express Grid Services Coordination
",An OWL-S Based Approach to Express Grid Services Coordination
/Users/sherry/Google_Drive/transfer/subset2_4/SchRecSubset4/SAC/SAC2005/p47-to.pdf,,Mobile Agents for Network Management: When and When Not!
/Users/sherry/Google_Drive/transfer/subset2_4/SchRecSubset4/SAC/SAC2005/p1-hutchinson.pdf,"Keynote Address The Future of Systematic Information Protection
",Keynote Address: The Future of Systematic Information Protection
/Users/sherry/Google_Drive/transfer/subset2_4/SchRecSubset4/SAC/SAC2005/p1009-crestani.pdf,"Editorial Message: Special Track on Information Access and Retrieval
",Track Editorial
/Users/sherry/Google_Drive/transfer/subset2_4/SchRecSubset4/SAC/SAC2005/p1155-delicato.pdf,"Reflective Middleware for Wireless Sensor Networks
",Reflective Middleware for Wireless Sensor Networks
/Users/sherry/Google_Drive/transfer/subset2_4/SchRecSubset4/SAC/SAC2005/p1674-baresi.pdf,"First Experiences on Constraining Consistency and Adaptivity of W2000 Models
",First Experiences on Constraining Consistency and Adaptivity of W2000 Models
/Users/sherry/Google_Drive/transfer/subset2_4/SchRecSubset4/SAC/SAC2005/p1288-gorappa.pdf,"Empirical Evaluation of OpenCCM for Java-based Distributed, Real-time, and Embedded Systems
","Empirical Evaluation of OpenCCM on Java-based Distributed, Real-time, and Embedded Systems"
/Users/sherry/Google_Drive/transfer/subset2_4/SchRecSubset4/SAC/SAC2005/p1207-yoon.pdf,"Interactive 3D Visualization of Highly Connected Ecological Networks on the WWW
",Interactive 3D Visualization of Highly Connected Ecological Networks on the WWW
/Users/sherry/Google_Drive/transfer/subset2_4/SchRecSubset4/SAC/SAC2005/p1427-tarau.pdf,"Agent Oriented Logic Programming in Jinni 2004
",Agent Oriented Logic Programming in Jinni 2004
/Users/sherry/Google_Drive/transfer/subset2_4/SchRecSubset4/SAC/SAC2005/p776-gruner.pdf,"Tool Support for Plagiarism Detection in Text Documents
",C:/Documents and Settings/fad-sg/Desktop/SAC_SE_2005/gruner.dvi
/Users/sherry/Google_Drive/transfer/subset2_4/SchRecSubset4/SAC/SAC2005/p1431-moore.pdf,"Order Relations and Rigor in Computing
",Order Relations and Rigor in Computing
/Users/sherry/Google_Drive/transfer/subset2_4/SchRecSubset4/SAC/SAC2005/p1118-leong.pdf,,Track Editorial
/Users/sherry/Google_Drive/transfer/subset2_4/SchRecSubset4/SAC/SAC2005/p1684-atterer.pdf,"Where Web Engineering Tool Support Ends: Building Usable Websites
",Where Web Engineering Tool Support Ends: Building Usable Websites
/Users/sherry/Google_Drive/transfer/subset2_4/SchRecSubset4/SAC/SAC2005/p724-neisse.pdf,"Policies Translation for Integrated Management of Grids and Networks
",Policies Translation for Integrated Management of Grids and Networks
